review_id,rating,review_text
7415,1,TERRIBLE AWFUL WORST LOL !!!
7416,1,bad late late awful terrible SUPER SUPER ...
7417,5,excellent great great great fantastic ... @@@
7418,3,TERRIBLE POOR TERRIBLE POOR LOL
7419,2,POOR AWFUL LATE TERRIBLE TERRIBLE LATE 😡 SUPER 😍
7420,2,LATE LATE TERRIBLE POOR LATE POOR LATE @@@
7421,3,POOR AWFUL AWFUL TERRIBLE POOR LATE AWFUL 😡
7422,2,AWFUL BAD WORST WORST POOR ... ###
7423,5,GREAT EXCELLENT AMAZING @@@
7424,2,TERRIBLE BAD POOR AWFUL ###
7425,1,TERRIBLE TERRIBLE WORST WORST POOR BAD TERRIBLE SUPER ###
7426,3,worst terrible bad poor @@@ 😡 ...
7427,5,good amazing good fantastic @@@ LOL
7428,3,WORST TERRIBLE AWFUL AWFUL SUPER 😡 SUPER
7429,4,GOOD AMAZING EXCELLENT GOOD GOOD LOL 😍 @@@
7430,1,late bad poor 😡 !!!
7431,2,BAD AWFUL WORST WORST WORST POOR WORST @@@ ...
7432,2,terrible poor terrible terrible poor bad @@@ LOL
7433,5,amazing great great awesome great great ...
7434,3,awful terrible terrible terrible ...
7435,1,LATE AWFUL BAD WORST LATE POOR !!! @@@
7436,1,bad bad worst terrible bad @@@ LOL @@@
7437,2,WORST BAD TERRIBLE TERRIBLE LOL ... ###
7438,1,worst late worst bad terrible worst !!!
7439,2,terrible late late terrible bad !!! ... ...
7440,1,POOR TERRIBLE LATE !!! ###
7441,5,GREAT FANTASTIC GOOD FANTASTIC GOOD LOL
7442,3,TERRIBLE POOR BAD BAD POOR TERRIBLE TERRIBLE SUPER ###
7443,2,worst poor terrible terrible worst 😍 @@@ ...
7444,4,awesome excellent fantastic great 😍 @@@
7445,1,bad bad bad SUPER
7446,4,EXCELLENT EXCELLENT GOOD FANTASTIC LOL LOL
7447,1,bad late late poor late bad !!! ...
7448,5,AWESOME EXCELLENT FANTASTIC FANTASTIC 😍
7449,3,awful awful bad worst worst ... !!! !!!
7450,5,AWESOME GOOD AMAZING LOL LOL
7451,1,WORST POOR LATE 😍
7452,2,AWFUL AWFUL BAD AWFUL !!! SUPER
7453,5,GOOD GREAT AWESOME EXCELLENT AWESOME AMAZING AMAZING ### !!!
7454,3,terrible late awful poor ... @@@ SUPER
7455,4,GREAT AMAZING GREAT ... ###
7456,4,fantastic good great excellent excellent good 😍 ###
7457,5,excellent good excellent fantastic ... @@@
7458,1,TERRIBLE WORST BAD SUPER
7459,2,late awful bad poor late late ...
7460,4,great fantastic excellent ### 😍 😍
7461,1,poor poor bad terrible bad awful @@@ ###
7462,1,BAD WORST LATE WORST AWFUL TERRIBLE WORST !!! SUPER 😍
7463,4,EXCELLENT GREAT FANTASTIC AMAZING FANTASTIC EXCELLENT EXCELLENT ... 😍 SUPER
7464,5,EXCELLENT EXCELLENT FANTASTIC GREAT ... !!!
7465,3,terrible awful bad ... SUPER !!!
7466,1,AWFUL BAD TERRIBLE ### LOL
7467,3,AWFUL LATE LATE AWFUL AWFUL 😍
7468,3,LATE POOR POOR TERRIBLE AWFUL 😍 😍 ...
7469,2,worst poor late awful SUPER
7470,1,poor worst worst worst !!! !!!
7471,3,TERRIBLE LATE BAD AWFUL LOL !!!
7472,4,GREAT EXCELLENT GOOD FANTASTIC FANTASTIC AWESOME 😍
7473,1,poor worst awful poor late worst ...
7474,4,excellent excellent amazing good @@@
7475,4,excellent amazing good excellent good amazing amazing SUPER 😡 ###
7476,4,GOOD GREAT EXCELLENT GREAT AWESOME LOL
7477,1,terrible poor bad awful late bad @@@ LOL
7478,4,excellent great excellent excellent SUPER LOL
7479,3,late poor bad late awful late LOL ###
7480,5,fantastic great amazing good ... 😡 @@@
7481,5,EXCELLENT AWESOME GREAT AWESOME @@@ ... ###
7482,2,worst late terrible late 😡 LOL LOL
7483,3,BAD POOR TERRIBLE LATE SUPER LOL ...
7484,5,good excellent great excellent fantastic excellent @@@ SUPER
7485,4,awesome great awesome 😍
7486,1,late worst terrible terrible terrible awful SUPER ###
7487,4,great fantastic awesome awesome 😍 ###
7488,3,poor bad poor terrible awful ### ...
7489,5,excellent great amazing good excellent good great SUPER
7490,1,LATE WORST LATE ... SUPER ###
7491,4,good amazing amazing great ### ... @@@
7492,5,GOOD GREAT FANTASTIC FANTASTIC FANTASTIC AMAZING AMAZING 😍 !!!
7493,4,FANTASTIC EXCELLENT AWESOME GOOD AMAZING GOOD AWESOME ### 😍
7494,5,GREAT GREAT GOOD 😍
7495,2,BAD BAD BAD TERRIBLE WORST WORST POOR 😡 SUPER ...
7496,2,AWFUL AWFUL WORST WORST LATE 😡 LOL @@@
7497,5,GREAT FANTASTIC GOOD 😡 SUPER 😡
7498,4,GOOD AWESOME AWESOME AMAZING AWESOME EXCELLENT AMAZING SUPER ...
7499,1,POOR POOR WORST POOR LATE AWFUL SUPER !!! SUPER
7500,2,terrible awful poor terrible bad !!! ...
7501,1,worst awful bad worst poor late ... !!! LOL
7502,4,good great amazing good great !!! !!! 😍
7503,4,GOOD FANTASTIC GREAT !!!
7504,3,WORST POOR LATE 😍
7505,4,GREAT AMAZING FANTASTIC GOOD !!!
7506,4,GOOD AMAZING FANTASTIC GREAT FANTASTIC GREAT ...
7507,3,bad terrible terrible bad awful bad LOL 😍 !!!
7508,5,good great good amazing awesome awesome 😡 LOL 😍
7509,3,LATE LATE POOR LATE TERRIBLE ...
7510,1,poor awful late worst late ... !!!
7511,2,LATE LATE AWFUL TERRIBLE AWFUL AWFUL LOL
7512,1,awful terrible bad ###
7513,5,awesome fantastic great ###
7514,5,EXCELLENT AWESOME GOOD GOOD SUPER LOL @@@
7515,4,GOOD AWESOME EXCELLENT FANTASTIC EXCELLENT SUPER
7516,2,WORST WORST POOR 😡
7517,5,excellent amazing fantastic amazing good great amazing SUPER @@@
7518,3,late late terrible 😍 ###
7519,5,good fantastic fantastic 😍 ...
7520,3,BAD POOR LATE POOR TERRIBLE POOR AWFUL @@@ @@@ ###
7521,2,TERRIBLE POOR POOR TERRIBLE TERRIBLE WORST POOR ### SUPER
7522,5,AMAZING GREAT AWESOME AWESOME ... ... !!!
7523,4,good amazing good amazing ... LOL @@@
7524,5,amazing fantastic great excellent good great great ### 😍
7525,3,terrible poor terrible late terrible late ### !!! ###
7526,2,BAD TERRIBLE TERRIBLE 😍 😍
7527,2,BAD LATE WORST WORST WORST ... 😍 !!!
7528,4,excellent excellent excellent amazing excellent amazing awesome 😡 LOL ...
7529,2,poor awful awful worst bad ### SUPER
7530,4,awesome awesome fantastic amazing amazing SUPER LOL 😍
7531,2,TERRIBLE TERRIBLE BAD LOL @@@ 😍
7532,2,LATE POOR POOR LATE 😍 SUPER
7533,3,AWFUL WORST POOR BAD LATE POOR ### SUPER LOL
7534,3,TERRIBLE BAD TERRIBLE AWFUL BAD 😡 SUPER
7535,3,terrible worst terrible terrible late poor bad SUPER 😍
7536,1,WORST WORST LATE AWFUL AWFUL TERRIBLE ... 😡 @@@
7537,5,GREAT EXCELLENT AWESOME GREAT ### @@@
7538,5,good good fantastic fantastic excellent ### LOL
7539,4,amazing amazing awesome amazing 😡 !!!
7540,5,amazing fantastic fantastic amazing awesome excellent amazing @@@
7541,3,TERRIBLE TERRIBLE BAD TERRIBLE SUPER SUPER
7542,3,terrible bad poor poor poor bad awful 😍 ### 😡
7543,2,TERRIBLE AWFUL WORST !!!
7544,3,LATE WORST WORST TERRIBLE LATE POOR BAD ### !!! LOL
7545,1,terrible bad worst bad terrible LOL ...
7546,5,GREAT EXCELLENT AWESOME GREAT FANTASTIC AWESOME @@@ SUPER 😍
7547,1,late bad awful @@@ LOL SUPER
7548,1,bad late bad poor late poor poor 😍 !!! !!!
7549,5,EXCELLENT AWESOME FANTASTIC AMAZING EXCELLENT FANTASTIC ... SUPER 😍
7550,2,LATE LATE BAD POOR TERRIBLE SUPER ... @@@
7551,4,GOOD FANTASTIC AWESOME FANTASTIC AMAZING AWESOME AMAZING @@@ 😍
7552,3,awful poor awful awful poor awful poor ### !!! 😍
7553,3,worst awful bad 😡 !!! @@@
7554,2,worst poor worst late awful bad LOL ... 😍
7555,1,poor late terrible ...
7556,5,amazing excellent awesome great 😍 @@@ ###
7557,1,bad terrible poor terrible terrible worst LOL SUPER
7558,4,great good good amazing good LOL ###
7559,2,LATE AWFUL BAD POOR POOR TERRIBLE @@@
7560,1,BAD BAD LATE ### SUPER ...
7561,1,BAD WORST LATE WORST POOR POOR SUPER 😍 ...
7562,4,AWESOME AMAZING AWESOME EXCELLENT GREAT 😍 ... !!!
7563,3,AWFUL WORST AWFUL 😍 ### 😍
7564,2,late worst bad awful 😡 😡
7565,4,great amazing great amazing amazing !!!
7566,2,AWFUL TERRIBLE BAD @@@
7567,5,fantastic amazing good awesome excellent @@@ SUPER
7568,4,EXCELLENT GOOD GREAT @@@
7569,2,BAD LATE AWFUL LATE SUPER 😍
7570,5,amazing good fantastic great awesome ### !!!
7571,3,worst terrible late awful terrible 😍 SUPER 😡
7572,3,poor worst terrible worst worst awful awful ###
7573,2,AWFUL BAD TERRIBLE AWFUL TERRIBLE AWFUL WORST @@@ @@@ SUPER
7574,5,GOOD AMAZING EXCELLENT GOOD SUPER SUPER SUPER
7575,4,EXCELLENT FANTASTIC EXCELLENT AWESOME @@@ SUPER
7576,4,excellent fantastic good ###
7577,1,LATE LATE LATE 😍
7578,5,FANTASTIC AMAZING EXCELLENT GOOD FANTASTIC LOL
7579,4,FANTASTIC GOOD EXCELLENT AWESOME AMAZING FANTASTIC !!! LOL @@@
7580,3,awful terrible bad bad ... !!!
7581,5,fantastic awesome great awesome great amazing !!! LOL
7582,4,good excellent amazing fantastic excellent ### 😡
7583,2,terrible awful worst !!! SUPER SUPER
7584,2,LATE POOR AWFUL POOR AWFUL TERRIBLE !!!
7585,1,poor late terrible late awful 😍 😍
7586,4,EXCELLENT GREAT AWESOME FANTASTIC EXCELLENT GREAT AMAZING ### 😍 😡
7587,4,AMAZING FANTASTIC AMAZING EXCELLENT 😍 !!! 😍
7588,1,late awful awful late late worst ... 😍 !!!
7589,5,great great great fantastic excellent good excellent 😍 @@@ 😍
7590,3,worst worst bad awful late ### ### 😍
7591,2,late awful worst bad late terrible poor ### @@@ 😍
7592,1,terrible late terrible awful worst late awful SUPER 😍
7593,1,TERRIBLE BAD AWFUL ... @@@ ...
7594,1,AWFUL WORST LATE BAD POOR LATE ###
7595,2,TERRIBLE BAD WORST LATE 😍 ###
7596,1,worst worst terrible terrible worst ### ...
7597,3,BAD POOR POOR BAD AWFUL TERRIBLE LATE ### 😡
7598,4,awesome great good good !!! LOL
7599,2,BAD POOR BAD AWFUL AWFUL LOL SUPER
7600,2,BAD BAD TERRIBLE TERRIBLE ... 😡 😡
7601,4,GOOD AMAZING GREAT !!!
7602,5,awesome fantastic amazing excellent ### LOL
7603,2,terrible terrible awful worst awful 😍
7604,2,worst awful worst worst bad bad 😡 ### SUPER
7605,3,late poor bad bad !!!
7606,2,bad awful late worst bad 😍 !!!
7607,5,GREAT AWESOME GOOD AMAZING @@@ 😍
7608,3,bad poor worst terrible 😡 ... 😡
7609,4,EXCELLENT GREAT AWESOME AWESOME 😡 !!! 😡
7610,1,worst bad terrible late ... @@@
7611,4,EXCELLENT AWESOME GREAT !!! 😍 ...
7612,1,awful awful late ### ... @@@
7613,1,worst poor bad late worst !!! 😍 !!!
7614,2,awful late late poor bad worst ... ... ...
7615,4,fantastic awesome good 😡 SUPER 😍
7616,1,terrible bad terrible worst late bad ... 😍
7617,4,EXCELLENT FANTASTIC AWESOME AWESOME AWESOME 😍
7618,5,AWESOME AWESOME EXCELLENT EXCELLENT EXCELLENT GREAT GOOD ### 😍 ###
7619,1,terrible late terrible !!! ... @@@
7620,3,poor terrible awful worst !!! 😡
7621,3,POOR LATE LATE AWFUL TERRIBLE LATE ### ... 😍
7622,2,terrible poor awful 😡 @@@ LOL
7623,5,EXCELLENT AWESOME AWESOME FANTASTIC AMAZING GREAT FANTASTIC SUPER 😍 SUPER
7624,1,WORST AWFUL BAD @@@
7625,2,poor awful bad bad ... LOL ...
7626,4,EXCELLENT FANTASTIC AWESOME GREAT ### SUPER
7627,2,LATE POOR BAD AWFUL WORST SUPER @@@
7628,2,awful bad poor late ... ###
7629,1,BAD WORST TERRIBLE AWFUL 😡 😍 ...
7630,2,awful bad terrible awful 😡 @@@ 😍
7631,4,AWESOME FANTASTIC AWESOME 😍 @@@ ...
7632,3,TERRIBLE LATE LATE BAD SUPER 😍
7633,3,late awful late bad bad worst terrible LOL
7634,1,TERRIBLE POOR TERRIBLE TERRIBLE TERRIBLE WORST LATE SUPER
7635,4,excellent excellent fantastic ... !!! !!!
7636,3,WORST POOR TERRIBLE TERRIBLE AWFUL TERRIBLE BAD ... 😡 😍
7637,5,FANTASTIC FANTASTIC FANTASTIC GREAT AMAZING FANTASTIC AMAZING LOL !!! !!!
7638,2,terrible worst poor late ###
7639,5,good great awesome excellent good ... SUPER
7640,3,bad poor bad ### ...
7641,1,LATE TERRIBLE LATE LATE SUPER SUPER ###
7642,5,GOOD AMAZING EXCELLENT FANTASTIC GOOD GOOD @@@ SUPER 😡
7643,2,poor bad awful 😡
7644,3,POOR WORST POOR POOR @@@ !!! ...
7645,3,worst awful poor worst worst poor awful ### ...
7646,2,AWFUL BAD TERRIBLE AWFUL POOR WORST ### LOL 😡
7647,3,POOR WORST WORST POOR POOR BAD ### SUPER
7648,5,amazing amazing excellent !!! @@@ ###
7649,2,POOR LATE WORST POOR POOR SUPER 😡
7650,2,WORST BAD TERRIBLE POOR TERRIBLE !!! 😡 !!!
7651,2,bad bad worst ### ... SUPER
7652,5,AMAZING EXCELLENT EXCELLENT AMAZING EXCELLENT 😍 @@@ 😡
7653,2,WORST TERRIBLE AWFUL AWFUL WORST ...
7654,5,fantastic great fantastic great good good excellent LOL
7655,3,LATE POOR LATE LATE AWFUL POOR ... 😡
7656,5,amazing great excellent !!!
7657,1,BAD POOR BAD AWFUL AWFUL POOR LATE 😍 @@@ SUPER
7658,5,AMAZING GOOD EXCELLENT EXCELLENT GOOD FANTASTIC LOL 😡
7659,4,good fantastic fantastic excellent awesome great 😍 @@@ ...
7660,4,EXCELLENT FANTASTIC FANTASTIC EXCELLENT FANTASTIC GREAT ### SUPER 😡
7661,3,WORST TERRIBLE BAD BAD LATE SUPER !!! ...
7662,5,EXCELLENT AWESOME EXCELLENT AMAZING EXCELLENT AWESOME SUPER SUPER ###
7663,4,EXCELLENT AWESOME AMAZING AMAZING AWESOME SUPER !!!
7664,1,terrible awful bad terrible 😡 SUPER
7665,2,POOR BAD WORST ...
7666,3,awful bad awful awful terrible worst bad LOL ... 😍
7667,1,POOR BAD TERRIBLE BAD POOR @@@ SUPER
7668,3,WORST WORST BAD TERRIBLE TERRIBLE SUPER SUPER ...
7669,4,GOOD GOOD AWESOME @@@ @@@ 😡
7670,2,TERRIBLE AWFUL AWFUL WORST TERRIBLE BAD POOR 😡
7671,5,awesome fantastic awesome fantastic awesome excellent 😍 😡 😡
7672,3,late awful poor worst late bad ### SUPER
7673,5,excellent fantastic amazing excellent excellent LOL
7674,3,POOR TERRIBLE WORST WORST WORST LATE POOR LOL LOL
7675,3,terrible bad terrible bad terrible ... ...
7676,5,awesome awesome amazing good ### @@@ ...
7677,2,AWFUL WORST WORST TERRIBLE ...
7678,5,excellent fantastic great great great excellent awesome ### !!!
7679,3,AWFUL AWFUL POOR TERRIBLE LATE TERRIBLE WORST LOL 😍 😡
7680,5,GREAT EXCELLENT GREAT EXCELLENT AWESOME AWESOME 😍 ### @@@
7681,3,poor bad worst poor awful poor terrible ###
7682,2,AWFUL TERRIBLE POOR WORST LATE BAD BAD 😍 😡 😍
7683,2,POOR WORST TERRIBLE POOR LATE ### ### LOL
7684,1,poor late terrible worst poor worst terrible ... SUPER ...
7685,4,good great amazing fantastic awesome excellent !!! ...
7686,4,EXCELLENT GREAT AWESOME @@@ @@@
7687,1,awful bad bad worst bad @@@ 😡 ###
7688,1,bad poor bad !!! SUPER
7689,2,LATE BAD AWFUL LOL
7690,5,EXCELLENT GREAT EXCELLENT GREAT FANTASTIC !!!
7691,2,late worst awful LOL ### !!!
7692,1,awful awful poor late poor poor poor @@@
7693,5,EXCELLENT AWESOME EXCELLENT GOOD AWESOME 😡
7694,3,POOR BAD BAD POOR !!!
7695,2,POOR WORST AWFUL AWFUL POOR !!! !!! 😍
7696,5,amazing excellent excellent LOL 😡 😡
7697,2,WORST POOR AWFUL LATE AWFUL ###
7698,4,awesome fantastic good great amazing excellent 😍
7699,1,terrible terrible late worst worst poor awful @@@ !!! ###
7700,1,bad late poor late terrible poor 😍
7701,1,bad poor terrible terrible worst LOL @@@ ...
7702,2,AWFUL TERRIBLE AWFUL POOR AWFUL 😍 ... ###
7703,1,POOR LATE LATE @@@
7704,2,bad bad worst poor bad poor !!! 😡
7705,3,poor bad awful poor poor poor awful LOL 😍
7706,4,FANTASTIC AMAZING FANTASTIC EXCELLENT AMAZING EXCELLENT FANTASTIC SUPER
7707,4,FANTASTIC GOOD EXCELLENT GREAT GOOD EXCELLENT GOOD SUPER LOL
7708,5,AWESOME GREAT AMAZING AMAZING EXCELLENT GREAT ...
7709,4,fantastic fantastic excellent fantastic !!! @@@ LOL
7710,2,awful awful poor poor terrible !!!
7711,3,POOR LATE WORST LATE AWFUL !!! !!!
7712,1,late awful bad LOL 😍 @@@
7713,1,AWFUL AWFUL WORST BAD POOR TERRIBLE BAD @@@
7714,3,bad late bad awful awful terrible awful ...
7715,4,amazing excellent great LOL !!!
7716,1,AWFUL BAD BAD 😡 LOL 😡
7717,4,GOOD AMAZING GOOD GREAT @@@ SUPER LOL
7718,3,POOR LATE TERRIBLE BAD BAD WORST ...
7719,5,GREAT GOOD AWESOME GOOD GOOD GREAT AMAZING ### @@@ 😡
7720,2,terrible awful late 😡 😡
7721,3,bad worst bad awful LOL
7722,2,AWFUL TERRIBLE POOR ### @@@ @@@
7723,1,late awful late late LOL 😡 😡
7724,1,BAD POOR AWFUL AWFUL POOR POOR AWFUL @@@
7725,5,EXCELLENT AWESOME GOOD AMAZING AMAZING AWESOME ### 😍
7726,3,worst late poor terrible LOL ###
7727,2,BAD WORST AWFUL LOL 😍
7728,4,great fantastic excellent good SUPER 😍 SUPER
7729,5,awesome fantastic good ...
7730,3,poor late late late worst late !!! 😍 😍
7731,3,WORST AWFUL WORST WORST @@@
7732,5,AMAZING AMAZING GREAT AMAZING ... 😡 😡
7733,4,AMAZING FANTASTIC GOOD FANTASTIC GOOD FANTASTIC LOL
7734,1,POOR TERRIBLE LATE BAD TERRIBLE LATE 😡 LOL
7735,2,AWFUL LATE AWFUL AWFUL TERRIBLE !!! 😍 😍
7736,4,fantastic awesome great great excellent @@@ ... LOL
7737,5,amazing great awesome awesome great ...
7738,5,good amazing fantastic ... @@@ !!!
7739,4,FANTASTIC FANTASTIC AMAZING FANTASTIC AWESOME FANTASTIC GREAT SUPER
7740,3,WORST BAD AWFUL AWFUL POOR @@@
7741,2,bad bad poor poor poor @@@ @@@
7742,2,POOR AWFUL LATE TERRIBLE TERRIBLE 😡 @@@
7743,1,TERRIBLE AWFUL POOR WORST POOR TERRIBLE 😡 @@@ 😡
7744,2,POOR AWFUL AWFUL LATE AWFUL LOL
7745,5,FANTASTIC AMAZING FANTASTIC GOOD EXCELLENT AWESOME AWESOME 😡
7746,1,AWFUL LATE POOR AWFUL AWFUL ...
7747,2,late bad terrible terrible LOL
7748,5,good good excellent 😍 😡 ...
7749,3,bad worst late awful !!!
7750,5,excellent fantastic fantastic LOL 😡
7751,4,awesome good fantastic amazing great ### LOL !!!
7752,4,fantastic awesome great excellent LOL @@@ ...
7753,5,GOOD GREAT GOOD GOOD AWESOME EXCELLENT ...
7754,2,POOR BAD LATE TERRIBLE POOR TERRIBLE 😡
7755,1,late late late SUPER 😡 😍
7756,4,fantastic amazing great great @@@
7757,1,POOR POOR LATE AWFUL BAD BAD ...
7758,1,awful worst awful terrible late awful poor ### ... ...
7759,1,bad poor terrible late terrible worst LOL ###
7760,3,WORST AWFUL BAD POOR TERRIBLE AWFUL ... @@@
7761,5,fantastic fantastic great excellent great !!! ...
7762,5,excellent great great amazing excellent good awesome !!! LOL ...
7763,5,amazing fantastic fantastic amazing LOL 😍 SUPER
7764,5,FANTASTIC FANTASTIC FANTASTIC GREAT AMAZING EXCELLENT GOOD @@@ LOL
7765,1,awful late poor bad bad bad 😡 ... !!!
7766,5,fantastic excellent good excellent fantastic LOL 😍 ...
7767,4,GREAT AWESOME EXCELLENT AWESOME ...
7768,5,FANTASTIC FANTASTIC AMAZING FANTASTIC ...
7769,5,good fantastic amazing LOL ### @@@
7770,5,EXCELLENT GREAT EXCELLENT GOOD FANTASTIC AMAZING FANTASTIC ### 😍 SUPER
7771,3,TERRIBLE WORST BAD LATE TERRIBLE LATE AWFUL ... ... SUPER
7772,1,bad worst late bad terrible terrible terrible ### ###
7773,3,POOR BAD POOR BAD BAD WORST BAD !!!
7774,3,POOR WORST TERRIBLE BAD BAD BAD AWFUL @@@
7775,2,POOR WORST WORST POOR @@@
7776,5,FANTASTIC AMAZING GREAT GOOD AMAZING EXCELLENT FANTASTIC SUPER SUPER
7777,5,FANTASTIC AMAZING GREAT SUPER
7778,1,AWFUL WORST AWFUL AWFUL POOR LOL
7779,1,worst awful terrible ### 😡 SUPER
7780,4,amazing great fantastic fantastic great ... 😍
7781,1,poor awful late poor 😍
7782,2,POOR AWFUL POOR LOL
7783,4,EXCELLENT GOOD AWESOME AWESOME SUPER
7784,5,great fantastic awesome fantastic @@@ @@@
7785,2,bad awful poor late worst terrible poor ###
7786,1,poor poor poor terrible SUPER 😍 😍
7787,1,bad poor terrible awful @@@
7788,3,worst worst poor poor worst awful @@@ !!!
7789,1,awful awful late awful terrible late worst @@@ ... SUPER
7790,3,BAD WORST BAD POOR LATE @@@ !!! !!!
7791,4,AWESOME FANTASTIC AMAZING GOOD AWESOME @@@ LOL SUPER
7792,3,bad late bad terrible LOL @@@ 😡
7793,3,worst awful worst worst SUPER @@@ ...
7794,4,good good great good awesome 😡 SUPER
7795,5,good amazing good ### LOL ###
7796,2,LATE BAD AWFUL @@@ !!!
7797,2,bad bad bad bad late worst 😡 !!! ...
7798,2,BAD POOR BAD BAD TERRIBLE AWFUL WORST LOL ### LOL
7799,5,AMAZING FANTASTIC GREAT FANTASTIC FANTASTIC FANTASTIC GREAT ### ###
7800,3,AWFUL TERRIBLE WORST AWFUL LOL 😡
7801,3,AWFUL BAD WORST WORST 😍 @@@ LOL
7802,2,POOR BAD AWFUL POOR POOR LATE WORST 😡 ...
7803,2,WORST LATE BAD LATE TERRIBLE WORST TERRIBLE 😍 😍 LOL
7804,3,awful awful worst late bad worst bad LOL LOL
7805,3,bad worst late terrible poor ### LOL
7806,2,LATE POOR TERRIBLE LATE BAD WORST POOR 😍 😍
7807,3,AWFUL POOR BAD POOR LATE LATE !!!
7808,5,good good good 😍 ###
7809,1,awful worst terrible ### !!! ...
7810,2,WORST WORST BAD @@@ !!!
7811,2,worst worst bad awful poor poor late ... LOL
7812,2,TERRIBLE BAD TERRIBLE ### 😡 ###
7813,2,TERRIBLE BAD AWFUL 😍
7814,5,EXCELLENT GREAT EXCELLENT AMAZING 😍 😍
7815,4,GOOD GREAT GOOD 😍 ### ...
7816,2,terrible worst late worst awful terrible ... ### LOL
7817,5,great good awesome amazing good good fantastic @@@ 😡
7818,5,good excellent great fantastic ### !!! 😍
7819,1,poor terrible late terrible bad awful LOL
7820,4,AWESOME AWESOME AWESOME GREAT AMAZING GREAT EXCELLENT LOL ### 😡
7821,1,terrible worst bad terrible terrible @@@ 😍
7822,3,terrible poor poor bad awful poor SUPER
7823,4,great good amazing great amazing great LOL @@@ ...
7824,1,poor poor poor !!! SUPER 😡
7825,3,late awful late bad poor late ...
7826,3,BAD POOR AWFUL TERRIBLE TERRIBLE ### 😍
7827,2,LATE LATE POOR TERRIBLE WORST LATE BAD ### 😡
7828,1,bad late poor ... !!! 😍
7829,2,WORST AWFUL AWFUL POOR LATE AWFUL SUPER
7830,1,AWFUL TERRIBLE POOR WORST POOR BAD POOR !!!
7831,4,FANTASTIC AWESOME AMAZING FANTASTIC GOOD GOOD GOOD SUPER ... !!!
7832,5,excellent good awesome amazing amazing fantastic 😍 😍 😍
7833,4,GOOD GREAT FANTASTIC SUPER
7834,5,good great fantastic excellent fantastic awesome 😡
7835,1,late awful awful awful late late terrible 😡 @@@ SUPER
7836,5,GOOD FANTASTIC GOOD EXCELLENT LOL @@@
7837,5,FANTASTIC GREAT EXCELLENT GREAT 😍 😡 @@@
7838,2,bad worst terrible awful awful poor poor 😡
7839,4,awesome fantastic awesome awesome good fantastic great @@@
7840,1,late worst worst worst bad late @@@ 😡
7841,1,POOR TERRIBLE WORST LATE 😍
7842,3,late terrible late late awful terrible ... !!! !!!
7843,1,bad worst awful awful ###
7844,5,excellent amazing good awesome fantastic good ### 😍
7845,5,GREAT GREAT GOOD AMAZING AMAZING 😍 LOL 😡
7846,4,great good excellent ...
7847,3,BAD TERRIBLE TERRIBLE POOR POOR TERRIBLE ... 😍
7848,1,terrible awful worst terrible late worst bad ... ...
7849,1,AWFUL WORST WORST AWFUL ... 😡 LOL
7850,1,BAD LATE POOR BAD SUPER 😍 @@@
7851,2,poor bad worst awful SUPER ...
7852,4,fantastic amazing fantastic excellent fantastic awesome ###
7853,4,AWESOME FANTASTIC AMAZING GREAT 😍
7854,1,TERRIBLE TERRIBLE WORST LATE ### 😍 LOL
7855,1,AWFUL BAD TERRIBLE BAD POOR AWFUL WORST LOL
7856,4,EXCELLENT AWESOME EXCELLENT 😍
7857,2,POOR LATE AWFUL LATE BAD ...
7858,4,FANTASTIC EXCELLENT EXCELLENT AMAZING AMAZING GREAT AMAZING !!! !!! LOL
7859,4,AMAZING AMAZING GOOD GREAT AWESOME FANTASTIC GREAT 😍 @@@ 😍
7860,1,AWFUL TERRIBLE AWFUL ### ###
7861,5,AMAZING FANTASTIC AMAZING AMAZING EXCELLENT ###
7862,1,AWFUL WORST AWFUL AWFUL 😡
7863,2,awful terrible worst SUPER
7864,2,WORST POOR LATE BAD BAD TERRIBLE 😡
7865,4,amazing amazing good good SUPER
7866,2,POOR WORST AWFUL TERRIBLE BAD BAD LOL
7867,1,LATE TERRIBLE POOR LATE BAD POOR AWFUL !!! ...
7868,2,WORST AWFUL WORST BAD POOR @@@
7869,1,POOR TERRIBLE WORST AWFUL ... 😡 LOL
7870,1,bad awful worst !!! LOL
7871,2,worst bad poor bad poor 😍 @@@ ###
7872,4,amazing fantastic great 😍
7873,1,bad late terrible poor worst ... 😍 ###
7874,3,awful worst bad SUPER SUPER
7875,1,awful awful terrible poor poor terrible SUPER 😡
7876,2,WORST LATE WORST 😍 !!!
7877,3,WORST POOR LATE WORST ### ###
7878,2,POOR TERRIBLE WORST BAD LATE @@@ ...
7879,3,worst awful terrible late late terrible LOL LOL
7880,5,GREAT AMAZING FANTASTIC AWESOME AWESOME EXCELLENT GOOD LOL
7881,4,GOOD GOOD GREAT AWESOME AWESOME FANTASTIC AMAZING 😍
7882,4,AMAZING AWESOME GREAT AMAZING AWESOME AMAZING ... LOL LOL
7883,3,POOR WORST BAD AWFUL ... SUPER !!!
7884,4,amazing awesome good amazing excellent good excellent !!! 😡 SUPER
7885,5,awesome awesome good awesome great great great ###
7886,1,AWFUL AWFUL AWFUL POOR BAD SUPER LOL ...
7887,2,worst awful late terrible poor 😍 😡 ###
7888,2,bad poor bad 😡 LOL SUPER
7889,2,WORST BAD BAD AWFUL WORST POOR ...
7890,1,WORST BAD AWFUL WORST BAD LATE BAD SUPER
7891,1,AWFUL AWFUL BAD POOR ### LOL
7892,5,GOOD AWESOME FANTASTIC AWESOME AMAZING AMAZING LOL ...
7893,4,GREAT AMAZING EXCELLENT GOOD 😍 😍
7894,2,poor terrible poor late awful awful bad @@@ @@@ @@@
7895,2,bad bad terrible late 😡
7896,2,TERRIBLE WORST BAD AWFUL WORST LATE WORST 😡 @@@
7897,4,excellent good amazing amazing fantastic SUPER ... SUPER
7898,2,LATE LATE LATE AWFUL POOR AWFUL 😍
7899,1,poor poor bad late awful poor late ### SUPER
7900,1,bad bad bad poor poor worst !!! @@@ @@@
7901,1,late terrible late late poor late ###
7902,3,terrible terrible poor late worst bad LOL SUPER LOL
7903,1,BAD LATE LATE LOL
7904,5,good good fantastic great great good fantastic 😡
7905,3,bad terrible late worst bad awful @@@
7906,4,GREAT GOOD FANTASTIC FANTASTIC EXCELLENT AMAZING GREAT !!!
7907,1,bad worst late ...
7908,4,AMAZING GOOD AWESOME GREAT AWESOME FANTASTIC GOOD 😡
7909,2,poor terrible awful bad !!! @@@ LOL
7910,4,AMAZING GOOD GREAT GREAT GOOD AWESOME FANTASTIC 😡 ###
7911,5,good awesome excellent good 😡
7912,5,amazing good fantastic 😍
7913,1,WORST LATE TERRIBLE LATE WORST WORST BAD LOL
7914,1,terrible terrible terrible poor late LOL 😡 😍
7915,2,AWFUL TERRIBLE TERRIBLE @@@ SUPER
7916,4,GOOD FANTASTIC AWESOME EXCELLENT GREAT SUPER ### SUPER
7917,1,POOR AWFUL POOR POOR POOR AWFUL 😡 ... @@@
7918,1,bad awful terrible terrible poor poor !!! ... @@@
7919,1,poor terrible awful SUPER
7920,1,late terrible terrible SUPER !!!
7921,2,BAD BAD POOR WORST 😍 😡 😍
7922,5,good fantastic excellent awesome excellent ### !!!
7923,1,TERRIBLE AWFUL LATE BAD TERRIBLE AWFUL LATE !!! ###
7924,2,WORST POOR TERRIBLE AWFUL WORST @@@ LOL ###
7925,1,BAD WORST AWFUL AWFUL BAD AWFUL AWFUL !!! ### LOL
7926,1,late terrible awful worst bad late 😡 ###
7927,4,EXCELLENT GREAT EXCELLENT LOL @@@ 😍
7928,3,LATE WORST BAD LATE BAD BAD !!! ### 😍
7929,4,awesome excellent good fantastic !!! ### ###
7930,1,BAD POOR AWFUL BAD BAD AWFUL TERRIBLE ### SUPER
7931,2,TERRIBLE POOR POOR LATE BAD LATE POOR LOL LOL
7932,4,GREAT FANTASTIC EXCELLENT AMAZING GREAT GOOD ... LOL
7933,4,excellent excellent good excellent excellent SUPER LOL @@@
7934,5,good amazing great amazing awesome awesome excellent ...
7935,1,POOR LATE AWFUL TERRIBLE LATE LATE ### 😡
7936,3,poor awful terrible poor late terrible late @@@
7937,2,worst bad awful worst late 😍 !!!
7938,2,BAD AWFUL BAD BAD WORST BAD TERRIBLE ... ### !!!
7939,3,TERRIBLE TERRIBLE TERRIBLE 😍
