review_id,rating,review_text
2119,4,EXCELLENT EXCELLENT AMAZING GREAT EXCELLENT ### ###
2120,2,awful worst late worst !!! ###
2121,5,awesome amazing fantastic awesome awesome ### 😡 @@@
2122,4,good amazing fantastic good excellent excellent awesome 😍 SUPER LOL
2123,2,BAD POOR POOR LATE LOL ...
2124,1,AWFUL AWFUL BAD LOL ... ...
2125,5,awesome awesome good SUPER @@@ 😡
2126,1,poor poor worst worst worst @@@ ...
2127,4,GOOD FANTASTIC AMAZING EXCELLENT EXCELLENT GOOD 😍
2128,1,POOR LATE TERRIBLE POOR BAD AWFUL AWFUL !!! @@@ LOL
2129,2,worst awful bad worst bad @@@ !!!
2130,2,BAD AWFUL AWFUL POOR ### 😡 SUPER
2131,5,amazing awesome amazing amazing good LOL 😡
2132,5,amazing fantastic excellent amazing great great great @@@ !!! @@@
2133,3,TERRIBLE TERRIBLE LATE TERRIBLE 😡
2134,1,bad awful awful late bad SUPER
2135,2,terrible bad terrible terrible poor @@@ !!! ...
2136,4,FANTASTIC GREAT AWESOME EXCELLENT SUPER
2137,4,GOOD AMAZING GREAT AWESOME GOOD GOOD @@@
2138,1,TERRIBLE POOR POOR BAD !!!
2139,3,AWFUL TERRIBLE TERRIBLE AWFUL AWFUL POOR 😡 ...
2140,5,AWESOME FANTASTIC EXCELLENT GREAT GOOD AMAZING EXCELLENT 😍 😡 😍
2141,4,excellent amazing excellent amazing good @@@
2142,3,AWFUL TERRIBLE BAD TERRIBLE AWFUL AWFUL AWFUL 😡 ... 😍
2143,1,AWFUL WORST LATE !!!
2144,4,great excellent excellent fantastic excellent great 😡 @@@
2145,4,fantastic awesome good amazing amazing excellent 😡 ... @@@
2146,1,late awful worst SUPER
2147,5,good amazing fantastic 😍 @@@ !!!
2148,3,awful late late late bad worst 😡
2149,3,POOR AWFUL AWFUL AWFUL POOR BAD BAD LOL @@@
2150,3,poor worst late terrible late 😡 SUPER
2151,3,BAD POOR TERRIBLE ### ###
2152,2,AWFUL TERRIBLE BAD POOR TERRIBLE TERRIBLE BAD !!! !!!
2153,1,bad poor poor bad awful poor poor 😡 😡 SUPER
2154,2,BAD BAD BAD BAD AWFUL WORST ### @@@ ...
2155,3,late late terrible SUPER
2156,1,bad poor poor bad !!! 😡
2157,5,EXCELLENT GOOD EXCELLENT AWESOME AMAZING ###
2158,4,EXCELLENT EXCELLENT GREAT !!!
2159,2,POOR LATE POOR LATE AWFUL WORST WORST LOL ###
2160,2,BAD AWFUL TERRIBLE !!! SUPER @@@
2161,2,awful poor awful SUPER
2162,3,poor worst poor worst 😡 ...
2163,4,EXCELLENT EXCELLENT GOOD AMAZING SUPER
2164,4,EXCELLENT EXCELLENT AWESOME GOOD GREAT FANTASTIC AWESOME 😍 ...
2165,4,FANTASTIC AWESOME GREAT AMAZING AMAZING !!! ...
2166,2,AWFUL POOR LATE WORST BAD TERRIBLE 😡
2167,4,excellent awesome great excellent fantastic SUPER LOL
2168,2,POOR WORST LATE AWFUL LOL ### 😡
2169,5,excellent fantastic amazing fantastic excellent great fantastic @@@ 😡 ###
2170,3,terrible late poor late SUPER
2171,3,TERRIBLE BAD BAD TERRIBLE ### LOL
2172,3,awful late bad late worst LOL
2173,5,amazing amazing great SUPER
2174,5,amazing fantastic fantastic great excellent good great ... 😡
2175,1,LATE POOR LATE LATE AWFUL LOL 😍
2176,5,GREAT EXCELLENT AWESOME FANTASTIC LOL
2177,1,LATE POOR WORST WORST WORST !!!
2178,4,GOOD AWESOME FANTASTIC GREAT AWESOME FANTASTIC EXCELLENT ### SUPER 😍
2179,5,AWESOME AMAZING FANTASTIC AWESOME EXCELLENT AMAZING FANTASTIC SUPER
2180,4,GREAT AWESOME AWESOME GREAT SUPER 😍
2181,2,TERRIBLE POOR LATE WORST LOL
2182,4,FANTASTIC AWESOME AMAZING GOOD AMAZING GREAT !!!
2183,3,LATE AWFUL LATE AWFUL !!!
2184,2,TERRIBLE POOR AWFUL AWFUL LATE @@@
2185,5,AMAZING GOOD AMAZING GOOD GREAT AMAZING GOOD !!! @@@
2186,3,LATE WORST POOR WORST TERRIBLE POOR TERRIBLE @@@ ###
2187,3,awful late terrible awful bad poor @@@ !!!
2188,5,GREAT AWESOME GOOD GOOD AWESOME FANTASTIC ... @@@ 😡
2189,3,poor poor late awful terrible 😡
2190,1,BAD LATE TERRIBLE 😡 SUPER LOL
2191,1,awful awful late bad !!! 😍 😡
2192,3,AWFUL WORST LATE 😡 ...
2193,2,late terrible late worst 😍 SUPER
2194,3,awful bad awful late worst awful ### 😍 ...
2195,3,terrible late poor poor late !!!
2196,3,BAD WORST POOR AWFUL BAD 😡
2197,5,awesome great good great @@@ LOL SUPER
2198,4,great fantastic fantastic ###
2199,1,worst worst late worst ### SUPER !!!
2200,2,terrible bad bad poor late @@@ @@@ !!!
2201,2,bad terrible poor bad poor @@@ @@@
2202,3,POOR WORST AWFUL POOR TERRIBLE ...
2203,1,TERRIBLE AWFUL TERRIBLE WORST WORST POOR !!! ###
2204,2,terrible worst poor poor ###
2205,3,poor worst terrible bad 😡 !!!
2206,2,bad poor awful awful awful poor 😍
2207,5,AMAZING FANTASTIC AWESOME AMAZING 😍 SUPER ###
2208,4,good fantastic great awesome awesome amazing !!! !!!
2209,5,GOOD GOOD AMAZING AWESOME FANTASTIC EXCELLENT AMAZING LOL 😍 !!!
2210,1,poor late bad bad poor bad ### SUPER LOL
2211,2,AWFUL POOR LATE TERRIBLE POOR BAD ###
2212,1,AWFUL BAD BAD WORST !!! ...
2213,3,LATE LATE LATE WORST ### @@@ SUPER
2214,2,LATE WORST WORST POOR ### @@@
2215,1,TERRIBLE BAD WORST TERRIBLE POOR WORST LOL LOL ###
2216,2,AWFUL POOR WORST 😍 😡 ...
2217,1,LATE POOR AWFUL LATE LATE WORST WORST ### @@@
2218,5,awesome amazing fantastic awesome ### ###
2219,5,EXCELLENT GREAT GREAT FANTASTIC GREAT GOOD !!!
2220,2,awful awful bad bad poor LOL @@@ @@@
2221,5,GOOD GREAT EXCELLENT @@@ 😡 ###
2222,1,awful terrible bad worst worst poor late @@@ LOL
2223,3,awful bad terrible bad terrible late LOL !!!
2224,3,LATE WORST POOR AWFUL 😍 ...
2225,3,poor awful poor terrible @@@
2226,3,awful worst bad LOL SUPER
2227,1,AWFUL LATE WORST WORST POOR TERRIBLE LATE SUPER
2228,5,excellent great excellent amazing good excellent good @@@ ###
2229,1,poor bad late poor late ... ### @@@
2230,4,excellent amazing good fantastic @@@ SUPER LOL
2231,4,amazing great excellent fantastic 😡 SUPER ...
2232,1,terrible poor worst terrible awful !!!
2233,2,bad bad awful awful poor 😡 ### @@@
2234,3,late awful bad 😍
2235,1,bad late bad bad SUPER
2236,5,excellent good good awesome SUPER @@@ !!!
2237,5,GREAT GREAT GOOD FANTASTIC AMAZING !!!
2238,2,awful late late ... 😍
2239,2,LATE TERRIBLE LATE LATE POOR POOR 😍 😡 ###
2240,4,GREAT EXCELLENT FANTASTIC GOOD AMAZING FANTASTIC GREAT ### ### ...
2241,1,LATE TERRIBLE AWFUL AWFUL TERRIBLE LATE @@@ 😍 😍
2242,4,GREAT AMAZING GOOD AWESOME SUPER
2243,4,great great good good awesome great excellent !!! LOL 😡
2244,1,AWFUL TERRIBLE AWFUL WORST BAD WORST !!! 😡
2245,5,excellent good amazing 😡 SUPER
2246,3,terrible poor late 😡
2247,1,WORST AWFUL POOR ... ### ###
2248,4,amazing great amazing fantastic awesome great LOL ... !!!
2249,5,fantastic good good amazing great good 😡 SUPER 😡
2250,4,awesome great excellent amazing great fantastic SUPER
2251,5,amazing awesome good fantastic excellent 😍 ... SUPER
2252,2,awful bad awful worst terrible worst bad SUPER
2253,5,amazing excellent excellent amazing awesome fantastic amazing SUPER @@@ 😡
2254,4,great fantastic fantastic fantastic SUPER SUPER ###
2255,4,good fantastic excellent awesome fantastic !!! SUPER
2256,1,late bad late poor awful bad ### 😍 LOL
2257,4,excellent good excellent awesome excellent 😍 ###
2258,4,great amazing great great amazing amazing great !!! ... 😡
2259,3,bad worst terrible bad late terrible terrible 😡
2260,3,WORST BAD TERRIBLE AWFUL WORST POOR LOL ### !!!
2261,4,great fantastic fantastic awesome 😡 😡 ...
2262,1,AWFUL AWFUL AWFUL LATE POOR LATE ### ... 😡
2263,4,AWESOME AMAZING EXCELLENT EXCELLENT !!!
2264,2,BAD AWFUL BAD BAD BAD LATE WORST @@@ ... ###
2265,4,GOOD GOOD EXCELLENT GOOD EXCELLENT ###
2266,2,AWFUL TERRIBLE WORST LATE LATE TERRIBLE TERRIBLE 😡 @@@ ...
2267,5,excellent fantastic good excellent fantastic amazing fantastic ... 😍 @@@
2268,4,excellent excellent fantastic @@@
2269,5,GREAT EXCELLENT AMAZING AWESOME GREAT 😍 😍 @@@
2270,4,excellent awesome amazing ###
2271,1,terrible poor awful awful !!! @@@ 😍
2272,2,WORST WORST BAD AWFUL BAD AWFUL BAD ... 😡
2273,5,amazing excellent great 😍 😡 SUPER
2274,4,AMAZING AWESOME AMAZING 😍 LOL ###
2275,2,WORST BAD LATE TERRIBLE AWFUL @@@
2276,1,terrible awful worst late terrible poor !!! ...
2277,5,good great great great amazing fantastic excellent @@@ @@@
2278,4,AMAZING FANTASTIC EXCELLENT GOOD GREAT GOOD EXCELLENT !!! ###
2279,4,GOOD GOOD GREAT GREAT FANTASTIC GREAT GOOD @@@
2280,2,POOR AWFUL TERRIBLE AWFUL AWFUL AWFUL AWFUL !!! @@@
2281,4,amazing good great good ... !!! !!!
2282,2,late worst bad awful terrible @@@ @@@ SUPER
2283,4,fantastic awesome fantastic fantastic LOL !!! ...
2284,5,excellent amazing fantastic awesome 😡 ###
2285,3,LATE POOR WORST POOR LOL @@@
2286,3,bad awful poor 😍
2287,4,excellent awesome great awesome ### SUPER
2288,1,late awful late awful late @@@ @@@ 😍
2289,5,GOOD EXCELLENT AMAZING AWESOME @@@ @@@
2290,5,AMAZING GREAT AMAZING GREAT GOOD AMAZING SUPER
2291,5,good awesome amazing excellent great awesome fantastic LOL SUPER
2292,1,late terrible poor awful bad worst poor SUPER @@@ 😡
2293,4,good amazing fantastic great awesome excellent 😍 @@@
2294,1,worst awful worst awful terrible late bad LOL
2295,1,POOR LATE POOR AWFUL SUPER LOL
2296,4,AMAZING GREAT GREAT AWESOME AMAZING GOOD ... ###
2297,3,worst terrible awful late terrible LOL ### LOL
2298,5,good fantastic amazing 😍 @@@ !!!
2299,3,late poor poor bad terrible awful worst !!! SUPER
2300,2,bad terrible late late late terrible terrible LOL 😍
2301,2,LATE LATE WORST @@@
2302,3,BAD WORST TERRIBLE ... 😍 ...
2303,3,LATE LATE AWFUL POOR TERRIBLE WORST 😍 ... 😡
2304,4,excellent good awesome 😍
2305,1,WORST TERRIBLE WORST BAD ... 😡 ###
2306,3,terrible terrible poor poor worst @@@ !!!
2307,4,good good great good good @@@ ... 😡
2308,3,LATE WORST POOR AWFUL AWFUL ### @@@ ###
2309,4,GREAT AWESOME FANTASTIC ... 😡 SUPER
2310,5,GOOD AMAZING GOOD 😍 😡 SUPER
2311,5,awesome great fantastic 😍
2312,4,excellent awesome good excellent fantastic awesome great 😍 😍
2313,4,amazing fantastic amazing excellent great excellent excellent 😍 @@@ @@@
2314,1,worst terrible awful worst poor poor terrible LOL ### 😡
2315,1,awful bad poor LOL @@@
2316,3,terrible poor poor worst late 😡 😡 😡
2317,4,good amazing awesome great good awesome great !!! 😍 😡
2318,3,worst awful poor ... SUPER
2319,5,fantastic good good excellent awesome great @@@
2320,3,POOR POOR BAD LATE WORST BAD BAD ### ### ###
2321,2,LATE POOR LATE LATE WORST POOR BAD 😡 😍
2322,1,poor poor late 😡 SUPER ...
2323,4,EXCELLENT EXCELLENT GREAT ... ...
2324,5,EXCELLENT AWESOME FANTASTIC GOOD !!! ...
2325,2,POOR POOR TERRIBLE BAD WORST BAD POOR 😍 😡
2326,3,worst terrible late worst late worst terrible SUPER @@@ @@@
2327,4,awesome excellent fantastic amazing excellent awesome @@@
2328,2,awful terrible awful worst LOL ...
2329,5,FANTASTIC FANTASTIC GREAT GREAT AMAZING EXCELLENT @@@
2330,1,TERRIBLE BAD WORST WORST 😍 @@@ ###
2331,1,BAD LATE BAD TERRIBLE SUPER 😍 LOL
2332,3,late poor worst poor late poor ### ... LOL
2333,4,EXCELLENT GOOD AWESOME EXCELLENT AWESOME AMAZING ###
2334,3,POOR AWFUL TERRIBLE WORST LATE WORST 😡
2335,4,FANTASTIC GREAT GREAT AWESOME EXCELLENT AWESOME 😍 😡
2336,3,bad bad terrible poor terrible worst !!! ...
2337,2,BAD POOR AWFUL LATE TERRIBLE BAD LOL SUPER
2338,4,AMAZING GOOD FANTASTIC GREAT AWESOME GOOD FANTASTIC ... 😡
2339,4,awesome good amazing great excellent fantastic @@@ 😡
2340,4,amazing great good SUPER 😡
2341,4,AMAZING FANTASTIC GOOD FANTASTIC AMAZING GREAT EXCELLENT !!! @@@
2342,5,excellent awesome amazing good amazing excellent 😍
2343,2,worst terrible worst bad late ... !!! LOL
2344,1,WORST POOR TERRIBLE TERRIBLE ###
2345,5,great fantastic fantastic @@@ 😍 ###
2346,4,AWESOME AWESOME FANTASTIC EXCELLENT GOOD AWESOME AMAZING ### !!! ...
2347,5,GREAT GREAT FANTASTIC ### @@@
2348,4,great fantastic excellent awesome good fantastic ### ###
2349,4,fantastic awesome excellent excellent amazing great excellent @@@ ...
2350,2,worst bad bad bad LOL
2351,2,late terrible terrible poor SUPER @@@ ...
2352,2,BAD POOR LATE BAD AWFUL POOR @@@ LOL SUPER
2353,1,late worst terrible 😍 LOL
2354,2,poor late worst 😍
2355,3,terrible terrible terrible worst awful poor awful 😡 ...
2356,3,awful terrible late bad poor ... ### @@@
2357,4,GREAT AMAZING GOOD GOOD ### ...
2358,2,poor poor awful late poor worst LOL
2359,4,excellent good excellent !!! ### 😍
2360,5,EXCELLENT AMAZING EXCELLENT FANTASTIC GOOD @@@
2361,3,WORST TERRIBLE AWFUL LATE WORST WORST ###
2362,1,LATE LATE LATE TERRIBLE @@@ @@@ !!!
2363,3,worst awful terrible late ### ... LOL
2364,3,poor late late awful awful !!! SUPER
2365,4,excellent excellent awesome good amazing awesome amazing LOL ### ###
2366,3,bad awful late bad 😍 !!!
2367,5,excellent good great !!!
2368,1,bad late terrible ### !!! !!!
2369,2,POOR LATE AWFUL TERRIBLE POOR BAD AWFUL LOL @@@ @@@
2370,4,AMAZING GREAT EXCELLENT GREAT 😍
2371,3,bad terrible bad poor terrible late 😍 SUPER @@@
2372,5,fantastic excellent fantastic good good great amazing @@@
2373,4,GREAT FANTASTIC AWESOME AWESOME AWESOME FANTASTIC FANTASTIC LOL SUPER
2374,5,EXCELLENT AWESOME GREAT GREAT SUPER ### LOL
2375,2,POOR POOR LATE ... 😡 😍
2376,4,excellent good fantastic good awesome !!! LOL ...
2377,2,LATE WORST WORST TERRIBLE AWFUL WORST AWFUL ...
2378,2,awful late poor late late bad awful ... !!!
2379,1,terrible bad late 😍
2380,4,AMAZING GOOD FANTASTIC FANTASTIC AMAZING ...
2381,1,late late poor terrible 😡 😡
2382,2,TERRIBLE AWFUL AWFUL LATE LOL
2383,4,awesome great fantastic great !!! SUPER
2384,1,POOR LATE AWFUL 😡 😍 ...
2385,3,LATE TERRIBLE TERRIBLE BAD BAD LATE LATE SUPER SUPER ###
2386,1,TERRIBLE WORST LATE LOL 😍
2387,3,AWFUL TERRIBLE WORST POOR WORST POOR ### SUPER
2388,1,late bad worst SUPER
2389,2,WORST AWFUL TERRIBLE TERRIBLE 😡 !!!
2390,4,great good great awesome ###
2391,2,LATE POOR WORST AWFUL POOR ### 😍
2392,4,AWESOME AMAZING AMAZING AWESOME EXCELLENT AWESOME GOOD !!! SUPER
2393,4,awesome amazing great fantastic great amazing fantastic ... SUPER LOL
2394,1,terrible poor bad terrible !!!
2395,4,AMAZING AMAZING FANTASTIC AWESOME GOOD EXCELLENT GREAT @@@
2396,2,awful poor awful ###
2397,5,GOOD AMAZING AWESOME AWESOME EXCELLENT GREAT ### ###
2398,4,AMAZING AMAZING AWESOME EXCELLENT GOOD AWESOME 😍
2399,2,AWFUL WORST LATE BAD ### 😍
2400,3,WORST AWFUL LATE LATE !!!
2401,3,WORST LATE BAD TERRIBLE ###
2402,3,LATE POOR LATE WORST AWFUL TERRIBLE @@@ 😍 😍
2403,1,worst worst late late poor worst 😡 @@@
2404,5,GOOD FANTASTIC GREAT FANTASTIC AMAZING 😡 @@@
2405,1,terrible late poor terrible SUPER LOL !!!
2406,5,AWESOME GOOD GREAT GREAT AWESOME GOOD EXCELLENT LOL ...
2407,4,excellent good great excellent ... ...
2408,3,AWFUL AWFUL POOR WORST 😡 😡 ###
2409,3,TERRIBLE LATE BAD LOL
2410,5,amazing amazing excellent good great 😡 😍 @@@
2411,2,worst bad poor worst awful worst awful LOL 😍 ...
2412,4,good fantastic awesome great amazing excellent @@@ !!! LOL
2413,2,bad bad worst terrible terrible bad poor LOL SUPER
2414,5,good amazing amazing excellent ### LOL
2415,5,amazing awesome great great 😡 SUPER SUPER
2416,3,WORST WORST POOR POOR AWFUL WORST AWFUL LOL
2417,5,FANTASTIC FANTASTIC AMAZING AWESOME AMAZING ###
2418,2,late terrible terrible terrible 😍 !!!
2419,4,awesome great excellent fantastic SUPER !!! !!!
2420,4,amazing amazing awesome SUPER
2421,4,GOOD EXCELLENT FANTASTIC AWESOME EXCELLENT GOOD ### 😍 ###
2422,1,POOR BAD AWFUL LATE AWFUL POOR AWFUL LOL ... ...
2423,4,amazing excellent amazing ... LOL
2424,3,late poor terrible poor awful terrible poor LOL ...
2425,5,GREAT AMAZING EXCELLENT GREAT AMAZING SUPER ... SUPER
2426,2,terrible terrible worst worst bad bad ###
2427,1,BAD LATE BAD LATE TERRIBLE BAD 😍 ...
2428,4,EXCELLENT EXCELLENT FANTASTIC AMAZING EXCELLENT EXCELLENT AWESOME 😡
2429,2,worst bad bad worst late SUPER
2430,4,GREAT GOOD EXCELLENT GOOD GOOD AWESOME AMAZING ... @@@ !!!
2431,2,worst bad worst worst bad terrible poor ### LOL
2432,3,BAD LATE WORST TERRIBLE 😡 LOL
2433,4,great fantastic amazing awesome great amazing fantastic SUPER ...
2434,3,poor awful poor bad ... SUPER
2435,3,AWFUL POOR LATE TERRIBLE WORST TERRIBLE !!!
2436,2,late awful terrible late awful bad 😍 ...
2437,4,fantastic good amazing amazing 😍
2438,1,poor terrible bad late poor LOL 😡
2439,3,worst worst worst terrible worst bad ...
2440,3,POOR POOR BAD AWFUL LOL 😡
2441,2,WORST WORST WORST 😍
2442,4,good fantastic amazing amazing fantastic awesome excellent 😡 😍
2443,1,WORST POOR POOR TERRIBLE TERRIBLE TERRIBLE 😡 😡
2444,2,LATE POOR TERRIBLE TERRIBLE BAD !!! 😍
2445,2,awful terrible late 😍
2446,1,bad poor poor awful terrible terrible late ...
2447,4,GOOD AMAZING AWESOME AMAZING @@@
2448,3,bad awful bad awful awful terrible LOL !!!
2449,1,TERRIBLE LATE POOR AWFUL AWFUL POOR BAD ...
2450,1,terrible late late bad awful poor !!! ### SUPER
2451,4,EXCELLENT AMAZING GREAT EXCELLENT AMAZING FANTASTIC !!!
2452,5,fantastic fantastic excellent fantastic great amazing amazing !!! @@@
2453,4,awesome amazing excellent amazing 😡 ...
2454,3,AWFUL POOR WORST ... SUPER
2455,4,excellent great amazing @@@
2456,4,EXCELLENT GREAT EXCELLENT EXCELLENT EXCELLENT FANTASTIC ... 😍
2457,4,AMAZING EXCELLENT GREAT AWESOME EXCELLENT EXCELLENT ### ### 😡
2458,3,late worst bad poor SUPER LOL
2459,4,good awesome excellent excellent excellent great LOL ... ...
2460,1,WORST POOR LATE @@@
2461,4,AMAZING AMAZING GREAT FANTASTIC GOOD AMAZING 😡 😡 !!!
2462,4,AWESOME AWESOME GREAT AMAZING ... 😍
2463,1,awful awful poor worst terrible SUPER ### SUPER
2464,5,excellent excellent excellent good good awesome fantastic !!! 😍 @@@
2465,3,terrible awful bad late terrible bad @@@
2466,2,worst terrible worst worst ### !!! ...
2467,3,AWFUL BAD AWFUL BAD BAD AWFUL WORST !!! @@@ @@@
2468,4,great awesome fantastic ... @@@ LOL
2469,5,excellent excellent amazing good good good @@@
2470,5,amazing excellent great LOL
2471,3,BAD LATE LATE BAD !!! ### SUPER
2472,3,BAD WORST AWFUL TERRIBLE AWFUL 😡 SUPER LOL
2473,4,AWESOME GOOD GOOD AWESOME 😍 ...
2474,3,terrible worst late @@@ ...
2475,4,awesome amazing excellent good excellent great good SUPER @@@
2476,2,TERRIBLE LATE BAD POOR AWFUL SUPER SUPER
2477,1,poor awful poor terrible terrible SUPER
2478,1,poor worst awful awful bad ### SUPER ...
2479,4,amazing good awesome awesome good great excellent LOL ... 😡
2480,2,worst terrible awful bad worst late ###
2481,2,TERRIBLE AWFUL AWFUL LATE WORST 😡
2482,1,awful terrible terrible worst late terrible terrible 😍 ... ...
2483,1,late poor poor SUPER
2484,1,POOR LATE BAD WORST TERRIBLE ###
2485,4,good awesome awesome awesome good good SUPER @@@ 😍
2486,3,awful poor awful bad late worst ... SUPER !!!
2487,4,FANTASTIC AWESOME AMAZING FANTASTIC GREAT FANTASTIC EXCELLENT ... 😍
2488,4,AWESOME AMAZING GOOD FANTASTIC @@@
2489,3,terrible worst worst worst 😍 LOL
2490,1,worst bad poor poor awful late SUPER
2491,4,AWESOME AWESOME GREAT @@@ 😍 @@@
2492,4,amazing excellent fantastic awesome great @@@
2493,5,FANTASTIC AWESOME GOOD AWESOME ... @@@ ###
2494,3,late awful late poor late awful bad 😍 😍 LOL
2495,5,AWESOME AMAZING FANTASTIC SUPER
2496,2,terrible awful awful bad terrible poor late @@@
2497,1,bad worst bad ### LOL
2498,5,amazing excellent great fantastic awesome excellent fantastic 😍 ### !!!
2499,2,AWFUL BAD POOR BAD AWFUL BAD 😍 LOL
2500,1,late bad worst awful worst poor ###
2501,3,AWFUL TERRIBLE WORST TERRIBLE AWFUL BAD LATE LOL @@@
2502,4,AWESOME EXCELLENT AMAZING AWESOME SUPER 😍
2503,2,awful bad late SUPER 😍 ...
2504,2,POOR AWFUL POOR LOL
2505,2,BAD AWFUL LATE WORST ... 😍 LOL
2506,1,worst worst bad late worst terrible ### @@@ LOL
2507,5,GOOD GREAT EXCELLENT 😍
2508,3,worst terrible bad bad awful worst bad @@@ SUPER
2509,1,late awful poor terrible awful bad poor !!! SUPER 😍
2510,3,terrible terrible poor 😡 😡
2511,5,AWESOME AWESOME GOOD AWESOME AWESOME !!! @@@ @@@
2512,4,FANTASTIC FANTASTIC EXCELLENT EXCELLENT GREAT @@@ LOL
2513,4,great awesome amazing LOL
2514,2,poor late awful SUPER ### ...
2515,1,worst awful late late LOL
2516,3,worst late worst worst terrible 😍 ... SUPER
2517,3,worst late awful awful bad worst 😡 !!!
2518,5,excellent good amazing excellent fantastic good fantastic ###
2519,5,amazing excellent good fantastic !!! ###
2520,1,AWFUL AWFUL LATE LATE LATE WORST !!! !!! ...
2521,3,terrible bad poor awful late poor SUPER SUPER @@@
2522,4,amazing amazing good awesome awesome amazing fantastic @@@ @@@
2523,1,TERRIBLE AWFUL POOR BAD WORST LOL
2524,3,awful poor late bad poor worst ### 😡
2525,3,AWFUL TERRIBLE WORST BAD !!! ... ###
2526,3,WORST BAD AWFUL TERRIBLE TERRIBLE POOR 😍 LOL 😍
2527,1,LATE BAD WORST TERRIBLE @@@ ###
2528,2,BAD LATE AWFUL 😡 ### 😍
2529,3,BAD WORST TERRIBLE ...
2530,1,LATE WORST WORST 😍 @@@ LOL
2531,5,EXCELLENT AWESOME EXCELLENT EXCELLENT AWESOME FANTASTIC GREAT SUPER
2532,5,fantastic great awesome awesome awesome fantastic SUPER
2533,5,great great good excellent fantastic LOL
2534,2,awful bad poor bad terrible poor ###
2535,5,GREAT EXCELLENT AWESOME GOOD FANTASTIC LOL 😡
2536,1,TERRIBLE BAD BAD WORST AWFUL BAD ###
2537,5,FANTASTIC GREAT FANTASTIC GREAT !!! 😡 ...
2538,1,worst late worst terrible bad bad 😍
2539,3,bad awful worst worst worst terrible ###
2540,1,worst worst terrible awful poor bad poor @@@
2541,5,GOOD GOOD AWESOME AMAZING GREAT GOOD ### LOL LOL
2542,5,great excellent great LOL
2543,2,poor bad terrible ... !!!
2544,2,BAD TERRIBLE LATE TERRIBLE TERRIBLE WORST 😡 LOL 😡
2545,5,FANTASTIC GREAT AMAZING AMAZING @@@
2546,4,excellent awesome amazing ### !!!
2547,4,EXCELLENT AWESOME GREAT EXCELLENT !!! LOL
2548,4,great good good amazing great ... ... !!!
2549,1,late bad worst worst awful awful late ... ###
2550,1,worst terrible awful poor terrible late LOL SUPER ...
2551,2,late worst late late bad SUPER
2552,4,AMAZING AMAZING AWESOME @@@
2553,1,bad bad worst awful terrible awful bad SUPER ... LOL
2554,5,GOOD FANTASTIC EXCELLENT ### 😡 @@@
2555,5,GOOD GOOD GOOD GOOD GREAT LOL
2556,3,worst late worst worst poor awful !!! ### 😍
2557,5,awesome fantastic fantastic great great awesome fantastic 😍 😡
2558,5,AWESOME GOOD FANTASTIC GOOD FANTASTIC LOL
2559,1,awful terrible late poor worst !!! @@@
2560,3,BAD POOR LATE 😡 😍 😍
2561,3,BAD LATE WORST BAD ... LOL LOL
2562,5,AMAZING FANTASTIC AMAZING AMAZING FANTASTIC SUPER ### !!!
2563,2,late awful poor bad awful 😡
2564,3,awful bad awful SUPER 😡
2565,2,late poor late late late late poor ... ... ...
2566,1,AWFUL AWFUL POOR TERRIBLE POOR 😍 @@@
2567,5,amazing good excellent @@@ 😍 😡
2568,5,GOOD AWESOME GREAT SUPER @@@ SUPER
2569,2,awful poor terrible bad 😡 SUPER
2570,4,great fantastic awesome ### 😡
2571,5,EXCELLENT AMAZING GREAT GOOD EXCELLENT GREAT GOOD 😡 !!!
2572,2,poor awful bad late poor @@@ !!! @@@
2573,1,awful awful late late ... ...
2574,4,AWESOME GOOD GOOD GREAT AMAZING EXCELLENT EXCELLENT 😍 ... 😍
2575,5,excellent fantastic amazing amazing fantastic SUPER LOL
2576,4,awesome fantastic awesome amazing great ### SUPER LOL
2577,2,poor bad awful late bad @@@ LOL @@@
2578,2,poor poor terrible poor awful bad SUPER ...
2579,4,GREAT EXCELLENT AMAZING ### @@@
2580,3,poor awful worst worst 😡 😍 SUPER
2581,1,poor late bad bad 😍
2582,2,AWFUL LATE BAD LATE LATE BAD BAD ### 😡
2583,1,WORST POOR WORST BAD SUPER LOL
2584,2,TERRIBLE WORST TERRIBLE LATE WORST WORST LATE ### LOL
2585,4,good good great great ... LOL
2586,2,awful poor poor worst worst @@@ ...
2587,1,worst bad terrible late bad awful awful LOL
2588,4,AMAZING GOOD FANTASTIC !!! LOL
2589,1,terrible bad worst awful awful terrible awful ...
2590,1,worst late late poor worst terrible 😍
2591,4,AWESOME AWESOME GOOD GREAT GOOD GREAT SUPER 😍 SUPER
2592,3,TERRIBLE POOR TERRIBLE LATE WORST WORST TERRIBLE LOL
2593,1,late late poor awful bad SUPER ###
2594,2,bad terrible poor awful @@@ ...
2595,5,great awesome good amazing great awesome fantastic LOL SUPER ###
2596,5,GREAT GREAT AMAZING GREAT AWESOME GREAT GOOD ###
2597,1,BAD POOR POOR LATE POOR POOR LOL 😡
2598,2,late poor late bad SUPER 😍
2599,2,LATE LATE BAD ... !!!
2600,3,bad terrible bad bad worst !!! @@@
2601,4,amazing awesome great good 😡 SUPER
2602,3,BAD BAD LATE POOR @@@ SUPER
2603,3,WORST WORST TERRIBLE WORST TERRIBLE WORST AWFUL @@@
2604,4,EXCELLENT GOOD FANTASTIC AMAZING GOOD GREAT ... SUPER
2605,4,amazing great fantastic excellent great good excellent ### SUPER
2606,4,amazing fantastic fantastic 😍
2607,1,worst bad late bad LOL 😍 LOL
2608,2,worst late bad SUPER !!!
2609,2,TERRIBLE BAD POOR TERRIBLE AWFUL 😍 ###
2610,4,GOOD FANTASTIC GREAT AMAZING GREAT !!!
2611,3,poor terrible awful !!!
2612,2,BAD TERRIBLE TERRIBLE LATE POOR POOR ### ### @@@
2613,2,AWFUL WORST POOR TERRIBLE ### 😡 @@@
2614,1,late terrible bad worst late late @@@ 😡
2615,4,AMAZING AWESOME GOOD GREAT AMAZING AMAZING AMAZING SUPER
2616,1,LATE AWFUL POOR LOL 😡
2617,4,GOOD FANTASTIC GREAT EXCELLENT FANTASTIC AWESOME SUPER
2618,1,AWFUL POOR BAD ###
2619,2,POOR WORST TERRIBLE AWFUL WORST 😡 !!!
2620,4,GOOD GREAT AWESOME AWESOME FANTASTIC FANTASTIC ###
2621,2,terrible poor terrible late terrible ... ### 😡
2622,4,excellent awesome awesome 😡 SUPER
2623,1,AWFUL BAD AWFUL WORST BAD WORST ... SUPER ###
2624,2,awful bad late late late SUPER
2625,1,WORST WORST WORST AWFUL LATE 😍 ### @@@
2626,4,AMAZING FANTASTIC GREAT !!! @@@ SUPER
2627,3,terrible terrible worst terrible worst ###
2628,2,poor awful poor terrible late worst poor SUPER 😍
2629,4,EXCELLENT FANTASTIC AWESOME EXCELLENT GOOD 😡
2630,5,AMAZING AMAZING GOOD ### ...
2631,4,AWESOME AMAZING AWESOME AMAZING AMAZING 😡
2632,2,LATE BAD BAD BAD LATE TERRIBLE AWFUL LOL ... @@@
2633,4,EXCELLENT GOOD EXCELLENT GOOD FANTASTIC @@@ SUPER !!!
2634,1,LATE WORST TERRIBLE BAD LOL ### !!!
2635,3,late terrible late worst bad poor late ... 😡
2636,5,great good great fantastic awesome awesome ...
2637,2,worst terrible terrible bad terrible poor terrible ### 😍
2638,2,LATE BAD WORST TERRIBLE 😡 😡
2639,2,late bad late ###
2640,4,amazing fantastic great ... ...
2641,3,BAD LATE WORST SUPER ###
